{
  "$schema": "../../schemas/api-profile-execution-plan.schema.json",
  "profile": "openai-compatible",
  "schema_version": "openai-compatible/1",
  "adapter": "vllm-nnrp-adapter",
  "artifacts": {
    "results_path": "artifacts/api-profile-results.json",
    "evidence_dir": "artifacts/api-profile-evidence"
  },
  "coverage_matrix": [
    {
      "feature": "chat.completions.create",
      "required_capabilities": [
        "api.level1",
        "api.chat.completions.create",
        "api.streaming"
      ],
      "summary": {
        "selected_cases": 1,
        "not_claimed_cases": 0,
        "informational_cases": 0
      },
      "statuses": {
        "mandatory_cases": 1,
        "optional_cases": 0,
        "experimental_cases": 0,
        "deprecated_cases": 0
      },
      "case_ids": [
        "openai-compatible.chat.streaming-text"
      ]
    }
  ],
  "cases": [
    {
      "id": "openai-compatible.chat.streaming-text",
      "operation": "chat.completions.create",
      "status": "mandatory",
      "required_capabilities": [
        "api.level1",
        "api.chat.completions.create",
        "api.streaming"
      ],
      "request": {
        "body": {
          "model": "example-model",
          "messages": [
            {
              "role": "user",
              "content": "Say hello."
            }
          ],
          "stream": true
        }
      },
      "expect": {
        "events": [
          {
            "type": "response.output_text.delta",
            "min_count": 1
          }
        ],
        "terminal": "success"
      }
    }
  ]
}
